{
  "benchmark_id": "indian-constitution-temporal-qa-initial-v1",
  "planning_goal": 209,
  "systems": [
    "System A — Base LLM",
    "System B — Static RAG",
    "System C — Temporal RAG"
  ],
  "questions": [
    {
      "question_id": "Q001",
      "question": "What guarantee does Article 14 state?",
      "reference_date": "2026-05-01",
      "question_category": "direct_article_lookup",
      "target_articles": [
        "14"
      ],
      "expected_answer": "The State shall not deny to any person equality before the law or the equal protection of the laws within the territory of India.",
      "gold_evidence": [
        {
          "evidence_id": "Q001-E1",
          "source_reference_id": "constitution-2026",
          "evidence_text": "14. Equality before law.—The State shall not deny to any person equality before the law or the equal protection of the laws within the territory of India.",
          "chunk_id": "chunk-6100b381e336b62ecb405068",
          "version_id": null,
          "verification_status": "verified"
        }
      ],
      "expected_version_id": null,
      "expected_temporal_status": "current_snapshot",
      "difficulty": "easy",
      "verification_status": "verified",
      "source_references": [
        {
          "reference_id": "constitution-2026",
          "source_type": "indexed_primary_source",
          "source_document": "Constitution of India, PDF cover states as on 1 May 2026",
          "source_path": "raw/constitution/Constitution_of_India_2024.pdf",
          "source_url": null,
          "source_locator": "PDF p. 37; indexed chunk chunk-6100b381e336b62ecb405068",
          "verification_status": "verified",
          "notes": "Text is from the local primary-source PDF text layer and its static index. Article heading is included in the cited passage; answer quotes operative wording only."
        }
      ],
      "evaluation_status": "suitable_for_evaluation"
    },
    {
      "question_id": "Q002",
      "question": "List the freedoms stated in Article 19(1).",
      "reference_date": "2026-05-01",
      "question_category": "direct_article_lookup",
      "target_articles": [
        "19"
      ],
      "expected_answer": "Article 19(1) lists citizens' rights to freedom of speech and expression; to assemble peaceably and without arms; to form associations or unions or co-operative societies; to move freely throughout India; to reside and settle in any part of India; and to practise any profession or carry on any occupation, trade or business. The current text prints an omission marker at clause (f).",
      "gold_evidence": [
        {
          "evidence_id": "Q002-E1",
          "source_reference_id": "constitution-2026",
          "evidence_text": "(1) All citizens shall have the right",
          "chunk_id": "chunk-d21f8f962357632e557f6731",
          "version_id": null,
          "verification_status": "verified"
        },
        {
          "evidence_id": "Q002-E2",
          "source_reference_id": "constitution-2026",
          "evidence_text": "(a) to freedom of speech and expression; (b) to assemble peaceably and without arms; (c) to form associations or unions 2[or co-operative societies]; (d) to move freely throughout the territory of India;",
          "chunk_id": "chunk-d21f8f962357632e557f6731",
          "version_id": null,
          "verification_status": "verified"
        },
        {
          "evidence_id": "Q002-E3",
          "source_reference_id": "constitution-2026",
          "evidence_text": "(e) to reside and settle in any part of the territory of India; 1[and] 2[(f)* * * * *] (g) to practise any profession, or to carry on any occupation, trade or business.",
          "chunk_id": "chunk-b9871ed7fee6588a145ac1da",
          "version_id": null,
          "verification_status": "verified"
        }
      ],
      "expected_version_id": null,
      "expected_temporal_status": "current_snapshot",
      "difficulty": "medium",
      "verification_status": "verified",
      "source_references": [
        {
          "reference_id": "constitution-2026",
          "source_type": "indexed_primary_source",
          "source_document": "Constitution of India, PDF cover states as on 1 May 2026",
          "source_path": "raw/constitution/Constitution_of_India_2024.pdf",
          "source_url": null,
          "source_locator": "PDF pp. 40–41; indexed Article 19 chunks listed in gold evidence",
          "verification_status": "verified",
          "notes": "The cited excerpts reproduce exact substrings of the indexed passages, including amendment footnote markers. The index stores two em dash glyphs as U+FFFD in surrounding text; those damaged characters are excluded from the excerpts rather than silently normalized. The PDF page image has not been independently visually audited."
        }
      ],
      "evaluation_status": "suitable_for_evaluation"
    },
    {
      "question_id": "Q003",
      "question": "What does Article 21 say about deprivation of life or personal liberty?",
      "reference_date": "2026-05-01",
      "question_category": "direct_article_lookup",
      "target_articles": [
        "21"
      ],
      "expected_answer": "No person shall be deprived of life or personal liberty except according to procedure established by law.",
      "gold_evidence": [
        {
          "evidence_id": "Q003-E1",
          "source_reference_id": "constitution-2026",
          "evidence_text": "21. Protection of life and personal liberty.—No person shall be deprived of his life or personal liberty except according to procedure established by law.",
          "chunk_id": "chunk-d6191916210d8ec466f42f4e",
          "version_id": null,
          "verification_status": "verified"
        }
      ],
      "expected_version_id": null,
      "expected_temporal_status": "current_snapshot",
      "difficulty": "easy",
      "verification_status": "verified",
      "source_references": [
        {
          "reference_id": "constitution-2026",
          "source_type": "indexed_primary_source",
          "source_document": "Constitution of India, PDF cover states as on 1 May 2026",
          "source_path": "raw/constitution/Constitution_of_India_2024.pdf",
          "source_url": null,
          "source_locator": "PDF p. 42; indexed chunk chunk-d6191916210d8ec466f42f4e",
          "verification_status": "verified",
          "notes": "Current snapshot text only."
        }
      ],
      "evaluation_status": "suitable_for_evaluation"
    },
    {
      "question_id": "Q004",
      "question": "What does Article 21A provide?",
      "reference_date": "2026-05-01",
      "question_category": "direct_article_lookup",
      "target_articles": [
        "21A"
      ],
      "expected_answer": "The State shall provide free and compulsory education to all children of the age of six to fourteen years in such manner as the State may, by law, determine.",
      "gold_evidence": [
        {
          "evidence_id": "Q004-E1",
          "source_reference_id": "constitution-2026",
          "evidence_text": "21A. Right to education.—The State shall provide free and compulsory education to all children of the age of six to fourteen years in such manner as the State may, by law, determine.",
          "chunk_id": "chunk-1078db9e04620397c7d1e229",
          "version_id": null,
          "verification_status": "verified"
        }
      ],
      "expected_version_id": null,
      "expected_temporal_status": "current_snapshot",
      "difficulty": "easy",
      "verification_status": "verified",
      "source_references": [
        {
          "reference_id": "constitution-2026",
          "source_type": "indexed_primary_source",
          "source_document": "Constitution of India, PDF cover states as on 1 May 2026",
          "source_path": "raw/constitution/Constitution_of_India_2024.pdf",
          "source_url": null,
          "source_locator": "PDF p. 42; indexed chunk chunk-1078db9e04620397c7d1e229",
          "verification_status": "verified",
          "notes": "Text is current snapshot evidence. This does not make the partially verified historical Article 21A pilot record verified."
        }
      ],
      "evaluation_status": "suitable_for_evaluation"
    },
    {
      "question_id": "Q005",
      "question": "What does the current Article 45 direct the State to endeavour to provide?",
      "reference_date": "2026-05-01",
      "question_category": "direct_article_lookup",
      "target_articles": [
        "45"
      ],
      "expected_answer": "The State shall endeavour to provide early childhood care and education for all children until they complete the age of six years.",
      "gold_evidence": [
        {
          "evidence_id": "Q005-E1",
          "source_reference_id": "constitution-2026",
          "evidence_text": "45. Provision for early childhood care and education to children below the age of six years.—The State shall endeavour to provide early childhood care and education for all children until they complete the age of six years.",
          "chunk_id": "chunk-f1dbc92527e9d297fff1dfca",
          "version_id": null,
          "verification_status": "verified"
        }
      ],
      "expected_version_id": null,
      "expected_temporal_status": "current_snapshot",
      "difficulty": "easy",
      "verification_status": "verified",
      "source_references": [
        {
          "reference_id": "constitution-2026",
          "source_type": "indexed_primary_source",
          "source_document": "Constitution of India, PDF cover states as on 1 May 2026",
          "source_path": "raw/constitution/Constitution_of_India_2024.pdf",
          "source_url": null,
          "source_locator": "PDF p. 54; printed p. 23; indexed chunk chunk-f1dbc92527e9d297fff1dfca",
          "verification_status": "verified",
          "notes": "Current snapshot text only; not represented as a verified temporal version record."
        }
      ],